description,severity
Tampering with system event logs activity logged.,High
System clock manipulated,High
Suspicious behavior: System clock manipulated,High
System clock manipulated was triggered on endpoint.,High
System clock manipulated observed by monitoring service.,High
Multiple user accounts locked simultaneously,High
Multiple user accounts locked simultaneously detected on host system.,High
System alert: Multiple user accounts locked simultaneously,High
Detected activity: Multiple user accounts locked simultaneously,High
Database encrypted without key escrow,Critical
Database encrypted without key escrow found during analysis.,Critical
Detected activity: Database encrypted without key escrow,Critical
Database encrypted without key escrow detected on host system.,Critical
Mass deletion of user home directories,Critical
Detected activity: Mass deletion of user home directories,Critical
Mass deletion of user home directories was triggered on endpoint.,Critical
Mass deletion of user home directories detected on host system.,Critical
Data destruction on cloud storage bucket,Critical
Data destruction on cloud storage bucket observed by monitoring service.,Critical
System alert: Data destruction on cloud storage bucket,Critical
Detected activity: Data destruction on cloud storage bucket,Critical
Critical configuration files overwritten,Critical
Detected activity: Critical configuration files overwritten,Critical
System alert: Critical configuration files overwritten,Critical
Critical configuration files overwritten was triggered on endpoint.,Critical
Sabotage of production server detected,Critical
Alert generated: Sabotage of production server detected,Critical
Sabotage of production server detected observed by monitoring service.,Critical
Sabotage of production server detected detected on host system.,Critical
Malware overwriting executable binaries,Critical
Malware overwriting executable binaries activity logged.,Critical
Malware overwriting executable binaries observed by monitoring service.,Critical
Malware overwriting executable binaries was triggered on endpoint.,Critical